{
  "contractVersion": "1.0.0",
  "runId": "33333333-3333-4333-8333-333333333333",
  "policyHash": "bbbbbbbbbbbbbbbbbbbbbbbbbbbbbbbbbbbbbbbbbbbbbbbbbbbbbbbbbbbbbbbb",
  "records": [
    {
      "scope": "connector-call",
      "operationId": "connector:enumerate-assets",
      "limit": 10485760,
      "usage": 1048576,
      "unit": "bytes",
      "cancellationCheckInterval": 1048576,
      "outcome": "completed",
      "startedAt": "2026-01-01T00:00:12Z",
      "completedAt": "2026-01-01T00:00:20Z",
      "cancelledAt": null,
      "reasonCode": null
    },
    {
      "scope": "model-call",
      "operationId": "50000000-0000-4000-8000-000000000001",
      "limit": 4000,
      "usage": 1200,
      "unit": "tokens",
      "cancellationCheckInterval": 256,
      "outcome": "completed",
      "startedAt": "2026-01-01T00:05:00Z",
      "completedAt": "2026-01-01T00:05:02Z",
      "cancelledAt": null,
      "reasonCode": null
    },
    {
      "scope": "stage",
      "operationId": "stage:extract-semantics",
      "limit": 90000,
      "usage": 60000,
      "unit": "milliseconds",
      "cancellationCheckInterval": 1000,
      "outcome": "completed",
      "startedAt": "2026-01-01T00:01:00Z",
      "completedAt": "2026-01-01T00:02:00Z",
      "cancelledAt": null,
      "reasonCode": null
    },
    {
      "scope": "run",
      "operationId": "33333333-3333-4333-8333-333333333333",
      "limit": 7200000,
      "usage": 620000,
      "unit": "milliseconds",
      "cancellationCheckInterval": 1000,
      "outcome": "completed",
      "startedAt": "2026-01-01T00:00:00Z",
      "completedAt": "2026-01-01T00:10:20Z",
      "cancelledAt": null,
      "reasonCode": null
    },
    {
      "scope": "prompt",
      "operationId": "prompt:semantic-asset:1.0.0",
      "limit": 32000,
      "usage": 12000,
      "unit": "characters",
      "cancellationCheckInterval": 1000,
      "outcome": "completed",
      "startedAt": "2026-01-01T00:04:59Z",
      "completedAt": "2026-01-01T00:05:00Z",
      "cancelledAt": null,
      "reasonCode": null
    },
    {
      "scope": "queue",
      "operationId": "queue:relationship-validation",
      "limit": 100000,
      "usage": 1,
      "unit": "items",
      "cancellationCheckInterval": 1,
      "outcome": "completed",
      "startedAt": "2026-01-01T00:03:00Z",
      "completedAt": "2026-01-01T00:04:00Z",
      "cancelledAt": null,
      "reasonCode": null
    },
    {
      "scope": "query",
      "operationId": "30000000-0000-4000-8000-000000000003",
      "limit": 10000,
      "usage": 2,
      "unit": "items",
      "cancellationCheckInterval": 100,
      "outcome": "completed",
      "startedAt": "2026-01-01T00:10:30Z",
      "completedAt": "2026-01-01T00:11:00Z",
      "cancelledAt": null,
      "reasonCode": null
    },
    {
      "scope": "traversal",
      "operationId": "traversal:validated-graph",
      "limit": 5,
      "usage": 2,
      "unit": "depth",
      "cancellationCheckInterval": 1,
      "outcome": "completed",
      "startedAt": "2026-01-01T00:09:00Z",
      "completedAt": "2026-01-01T00:09:05Z",
      "cancelledAt": null,
      "reasonCode": null
    },
    {
      "scope": "manifest",
      "operationId": "44444444-4444-4444-8444-444444444444",
      "limit": 6000,
      "usage": 4200,
      "unit": "tokens",
      "cancellationCheckInterval": 100,
      "outcome": "completed",
      "startedAt": "2026-01-01T00:09:05Z",
      "completedAt": "2026-01-01T00:10:00Z",
      "cancelledAt": null,
      "reasonCode": null
    }
  ],
  "capturedAt": "2026-01-01T00:11:01Z",
  "hashAlgorithm": "sha256-jcs",
  "contentHash": "ea82aeeacb10f2dccd1410c9a36dfbbc68f0ca708cc0fce376a777cecc290e47"
}
